{
  "district": "toxiatosh",
  "district_name": "Тахиатош",
  "region": "Қорақалпоғистон Республикаси",
  "year": 2026,
  "total": 16,
  "hero_kpis": {
    "Аҳоли": {
      "value": 68.3,
      "unit": "минг киши"
    },
    "Маҳалла": {
      "value": 18,
      "unit": "та"
    },
    "Оила": {
      "value": 15600,
      "unit": "та"
    },
    "Хонадон": {
      "value": 14900,
      "unit": "та"
    }
  },
  "indicators": [
    {
      "no": 1,
      "slide": 1,
      "slide_no": "1",
      "name": "Ҳудуднинг макроиқтисодий кўрсаткичлари",
      "desc": "Саноат, хизматлар ва экспортнинг ўсиш динамикаси",
      "value": "",
      "found": false,
      "source_org": "Статистика бошқармаси",
      "ai_insight": ""
    },
    {
      "no": 2,
      "slide": 2,
      "slide_no": "2",
      "name": "Инфратузилма ҳолати",
      "desc": "Йўл, сув, электр ва коммунал инфратузилма",
      "value": "",
      "found": false,
      "source_org": "Инфратузилма бошқармаси",
      "ai_insight": ""
    },
    {
      "no": 3,
      "slide": 3,
      "slide_no": "3",
      "name": "Аҳоли ва бандлик кўрсаткичлари",
      "desc": "Демография, меҳнат бозори ва ижтимоий ҳимоя",
      "value": "",
      "found": false,
      "source_org": "Бандлик бошқармаси",
      "ai_insight": ""
    },
    {
      "no": 4,
      "slide": 4,
      "slide_no": "4",
      "name": "Маҳалла тадбиркорлиги ва банк хизматлари",
      "desc": "Маҳалла даражасидаги тадбиркорлик ва молиявий хизматлар",
      "value": "",
      "found": false,
      "source_org": "SQB",
      "ai_insight": ""
    },
    {
      "no": 5,
      "slide": 5,
      "slide_no": "5",
      "name": "Туман имкониятлари ва салоҳияти",
      "desc": "Иқтисодий имкониятлар ва ривожланиш йўналишлари",
      "value": "",
      "found": false,
      "source_org": "Вилоят ҳокимияти",
      "ai_insight": ""
    },
    {
      "no": 6,
      "slide": 5,
      "slide_no": "5",
      "name": "«Яшил» энергетика хаби ва маҳаллийлаштириш",
      "desc": "Тахиатош ИЭС негизида гибрид энергетика моделини яратиш",
      "value": "Жами: Энергетика стратегияси | Стратегик мақсад: бутловчи қисмлар (трансформатор, кабель) ишлаб чиқариш | Потенциал: 2026 йилгача республикада 6,7 ГВт янги ВИЭ қувватлари | Имконият: энергияни сақлаш тизимлари (Energy Storage Systems) локализацияси",
      "found": true,
      "source_org": "Иқтисодиёт ва молия вазирлиги / Энергетика вазирлиги",
      "ai_insight": "Тахиатошнинг энергетика маркази эканидан фойдаланиб, қуёш ва шамол станциялари учун зарур бўлган трансформатор ва кабель маҳсулотларини шу ерда ишлаб чиқаришни йўлга қўйиш керак. Бу туман саноатини диверсификация қилади ва янги муҳандислик иш ўринларини яратади."
    },
    {
      "no": 7,
      "slide": 5,
      "slide_no": "5",
      "name": "Инновацион қурилиш материаллари кластери",
      "desc": "Базальт толаси ва ундан тайёрланган юқори технологияли маҳсулотлар",
      "value": "Жами: Қурилиш материаллари кластери | Йўналиш: базальт арматураси ва фиброцемент панеллар | Экспорт мақсади: 2025 йил якуни билан $8,3 млн дан ортиқ | Ресурс: саноат зоналаридаги 44% бўш майдондан фойдаланиш",
      "found": true,
      "source_org": "Туман ҳокимияти / Инвестиция бўлими",
      "ai_insight": "Базальт толаси ишлаб чиқариш лойиҳасини тўлиқ қувватга чиқариш орқали туманни инновацион қурилиш материаллари марказига айлантириш лозим. Ушбу маҳсулотларга ирригация ва кимё саноатида талаб юқорилигини инобатга олиб, маҳаллийлаштириш даражасини 60% га етказиш мумкин."
    },
    {
      "no": 8,
      "slide": 5,
      "slide_no": "5",
      "name": "Сунъий интеллект (AI) модулли маркази",
      "desc": "Катта ҳажмдаги маълумотларни қайта ишлаш ва ИТ-экотизимини яратиш",
      "value": "Жами: AI маркази лойиҳаси | Лойиҳа: Modular Intelligent Computing Center (модулли ҳисоблаш маркази) | Афзаллиги: ИЭСдан тўғридан-тўғри арзон ва барқарор электр энергияси | Ижтимоий таъсир: ИТ соҳасида 1 000 дан ортиқ ёшлар бандлигини таъминлаш",
      "found": true,
      "source_org": "Рақамли технологиялар вазирлиги",
      "ai_insight": "Тахиатошда энергия ресурсларининг етарлилиги СИ (AI) марказини қуриш учун энг қулай шароитдир. Бу нафақат туманни интеллектуал хабга айлантиради, балки юқори малакали кадрлар етиштириш орқали ёшлар миграциясини 15-20% га камайтиришга ёрдам беради."
    },
    {
      "no": 9,
      "slide": 5,
      "slide_no": "5",
      "name": "Оролбўйи минтақавий логистика узели",
      "desc": "Янги кўприк ва халқаро йўллар чорраҳасидаги имкониятлар",
      "value": "Жами: Логистика узели | Юк айланмаси: 1 941,5 минг тонна (йиллик) | Эҳтиёж: қўшимча 8 та замонавий омборхона терминали | Инфратузилма: Нукус ва Тахиатошни боғловчи янги Амударё кўприги",
      "found": true,
      "source_org": "Статистика бўлими / Транспорт вазирлиги",
      "ai_insight": "Географик жойлашув ва янги кўприк қурилишидан фойдаланиб, Тахиатошда «А» ва «Б» тоифали логистика терминалларини ташкил этиш зарур. Бу хизматлар экспортини 2025 йилда 456,4 млрд сўмга етказишнинг асосий драйвери бўлади."
    },
    {
      "no": 10,
      "slide": 5,
      "slide_no": "5",
      "name": "Экспортга йўналтирилган интенсив агросаноат",
      "desc": "Каналларни бетонлаштириш ва сув тежовчи технологияларни жорий этиш",
      "value": "Жами: Агросаноат стратегияси | Кўрсаткич: 2025 йилда 450 млрд сўмлик маҳсулот етиштириш | Ирригация: 320 км магистрал ва 3 300 км ички каналларни бетонлаштириш | Самарадорлик: фермерлар даромадини 20-35% га ошириш",
      "found": true,
      "source_org": "Қишлоқ хўжалиги бўлими",
      "ai_insight": "Сув тақчиллиги шароитида каналларни бетонлаштиришни жадаллаштириш ва мева-сабзавотларни сақлаш (Cold Storage) тизимини ривожлантириш лозим. Бу маҳсулот нобудгарчилигини камайтириб, ички ва ташқи бозорда нарх барқарорлигини таъминлайди."
    },
    {
      "no": 11,
      "slide": 5,
      "slide_no": "5",
      "name": "Дефицит товарларни маҳаллийлаштириш",
      "desc": "Истеъмол бозоридаги бўшлиқларни кичик бизнес орқали тўлдириш",
      "value": "Жами: Маҳаллийлаштириш стратегияси | Топ-3 дефицит: ўсимлик ёғи, маиший техника, озуқа маҳсулотлари | Молиялаштириш: 140 та микролойиҳа учун 98 млрд сўм кредит | Иш ўринлари: 300 та янги тўғридан-тўғри иш ўрни",
      "found": true,
      "source_org": "Савдо палатаси / SQB",
      "ai_insight": "Туманда энг кўп истеъмол қилинадиган, лекин четдан олиб келинадиган товарлар (ёғ, техника) ишлаб чиқаришни «Лойиҳа фабрикаси» орқали қўллаб-қувватлаш керак. Бу нафақат тадбиркорликни ривожлантиради, балки маҳаллий аҳоли учун маҳсулот арзонлашишига олиб келади."
    },
    {
      "no": 12,
      "slide": 6,
      "slide_no": "6",
      "name": "Хулоса ва ҳаракатлар режаси",
      "desc": "Якуний хулосалар, тавсиялар ва стратегик режа",
      "value": "",
      "found": false,
      "source_org": "SQB Аналитика",
      "ai_insight": ""
    },
    {
      "no": 13,
      "slide": 6,
      "slide_no": "6",
      "name": "Иқтисодий трансформация хулосаси",
      "desc": "Анъанавий саноатдан билимлар иқтисодиётига ўтиш босқичи",
      "value": "Жами: Трансформация таҳлили | Саноат ўсиши: +9,7% (2024 йил прогнози) | Хизматлар ўсиши: +16% (юқори фаоллик) | Стратегик мақсад: Тахиатошни «Интеллектуал энергетика хаби»га айлантириш",
      "found": true,
      "source_org": "СИ таҳлили",
      "ai_insight": "Туман иқтисодиёти барқарор ўсиш йўлига кирган. Эндиги вазифа — фақат ТЭСга боғланиб қолмай, ИТ ва инновацион материаллар ишлаб чиқаришни иқтисодиётнинг иккинчи ва учинчи устуни сифатида мустаҳкамлашдир."
    },
    {
      "no": 14,
      "slide": 6,
      "slide_no": "6",
      "name": "Инвестициявий портфель ва молиявий интизом",
      "desc": "2026 йил учун кредитлаш ва лойиҳаларни бошқариш режаси",
      "value": "Жами: Молиявий таҳлил | Умумий портфель: 1 250 млрд сўмлик 23 та йирик лойиҳа | 2026 режаси: 450 млрд сўм кредит (Саноат: 170, Кичик бизнес: 190) | Муаммо (NPL): оилавий тадбиркорликда 4% муаммоли кредитлар",
      "found": true,
      "source_org": "SQB молиявий таҳлили",
      "ai_insight": "Кредит маблағларини юқори қўшимча қиймат яратувчи саноат лойиҳаларига йўналтириш лозим. Оилавий тадбиркорликда NPL даражасини тушириш учун «маҳаллабай» тизимида молиявий саводхонлик тренингларини кўпайтириш тавсия этилади."
    },
    {
      "no": 15,
      "slide": 6,
      "slide_no": "6",
      "name": "Инфратузилмани радикал янгилаш",
      "desc": "Ичимлик суви, электр тармоқлари ва таълим қамрови",
      "value": "Жами: Инфратузилма янгилаш режаси | Сув таъминоти: 89,8 км янги тармоқ ва 2 та сув тақсимлаш узели | Энергетика: 48% трансформатор ва 59% тармоқларни модернизация қилиш | Таълим: боғча қамровини 78,3% га етказиш",
      "found": true,
      "source_org": "Туман ҳокимияти / Давлат дастурлари",
      "ai_insight": "Инфратузилманинг эскирганлиги иқтисодий ўсишни секинлаштирувчи асосий омилдир. 2026 йилда асосий инвестицияларни электр тармоқларини янгилашга йўналтириш керак, чунки бусиз янги СИ (AI) ва саноат корхоналарини барқарор ишлатиб бўлмайди."
    },
    {
      "no": 16,
      "slide": 6,
      "slide_no": "6",
      "name": "Инсон капитали ва ижтимоий қўллаб-қувватлаш",
      "desc": "Хотин-қизлар ва ёшлар бандлигини таъминлаш стратегияси",
      "value": "Жами: Ижтимоий стратегия | Аёллар бандлиги: 21 минг нафар аёлни тадбиркорликка ўқитиш | Инклюзивлик: ногиронлиги бор шахслар учун ИТ соҳасида иш ўринлари | Миграция: Германия ва бошқа давлатларга мақсадли касбий тайёрлаш",
      "found": true,
      "source_org": "Бандлик маркази / СИ таҳлили",
      "ai_insight": "Ишсиз ёшлар ва хотин-қизларни ИТ ва замонавий сервис хизматларига қайта ўқитиш тизимини кучайтириш лозим. Бу нафақат бандликни таъминлайди, балки аҳоли жон бошига даромадни йиллик 20% га оширишга хизмат қилади."
    }
  ]
}